<?xml version="1.0" encoding="UTF-8"?> 
<!--Añadimos la declarcion inicial en el que incluimos como atribito la version y el formato de codigo, esta 
siempre debe ser la primera linea del documento XML-->

<!--
Nombre: Raul Rivera Garrido
Curso: 1 º DAM
Fecha: [29/03/2025]
Cuento-2: Don Quijote
-->

<!--Definimos las ruta del DTD externo-->
<!DOCTYPE cuento SYSTEM "cuentos.dtd">

<cuento cod="F02" título="Don Quijote de la Mancha" género="fantasía">
    <personajes>
        <personaje id="Pers-1" tipo="principal">
            <nombre>Don Quijote</nombre>
            <género>M</género>
            <descripción>Un hidalgo que pierde la razon y se cree caballero andantee</descripción>
        </personaje>
        <personaje id="Person-2" tipo="secundario">
            <nombre>Sancho Panza</nombre>
            <género>M</género>
            <descripción>El fiel escudero de Don Quijote, practico y leal</descripción>
        </personaje>
    </personajes>
    <trama>Don Quijote emprende una serie de aventuras en busca de justicia, enfrentando molinos de viento y otros desafios</trama>
    <etiqueta nombre="aventura"/>
    <etiqueta nombre="caballería"/>
</cuento>
